1318,"Attack since speech media television.","categoria_1318"
1319,"Floor cover simple.","categoria_1319"
1320,"Just send style themselves nothing small man.","categoria_1320"
1321,"Agency rather value budget brother wear.","categoria_1321"
1322,"Candidate role raise huge.","categoria_1322"
1323,"Right fear because together full.","categoria_1323"
1324,"Arrive watch industry head authority staff artist summer.","categoria_1324"
1325,"If financial material with language.","categoria_1325"
1326,"Paper forward top Republican.","categoria_1326"
1327,"Only become nation husband contain science back.","categoria_1327"
1328,"Soldier five real positive once fly.","categoria_1328"
1329,"Central road issue care mean require especially PM.","categoria_1329"
1330,"Cover address election itself at story my individual.","categoria_1330"
1331,"Democrat good process level operation participant anything.","categoria_1331"
1332,"Show party body.","categoria_1332"
1333,"Again analysis huge mention me rate.","categoria_1333"
1334,"Offer believe nor authority fly affect.","categoria_1334"
1335,"Tv certain trade design around region reduce policy.","categoria_1335"
1336,"Democratic positive blue politics require product.","categoria_1336"
1337,"Special reality employee draw might join hotel.","categoria_1337"
1338,"Yet anyone operation maintain likely everyone grow.","categoria_1338"
1339,"State he within citizen statement.","categoria_1339"
1340,"Even road public share professional.","categoria_1340"
1341,"Record price might offer.","categoria_1341"
1342,"Adult together upon through.","categoria_1342"
1343,"Religious positive where.","categoria_1343"
1344,"Force protect per lose future factor environment.","categoria_1344"
1345,"As happy player more yard claim help.","categoria_1345"
1346,"Book these type church physical condition head.","categoria_1346"
1347,"Today huge serve stage admit probably wide enough.","categoria_1347"
1348,"Occur mind want consider staff.","categoria_1348"
1349,"Energy phone any exist east same.","categoria_1349"
1350,"Teach local represent buy property.","categoria_1350"
1351,"Home find behavior party talk staff.","categoria_1351"
1352,"Ball tough station source floor.","categoria_1352"
1353,"Four music suddenly race improve stand indeed.","categoria_1353"
1354,"Risk need wear vote skill sometimes in.","categoria_1354"
1355,"Bag evidence election result follow low.","categoria_1355"
1356,"Deep wonder rather they end happen control.","categoria_1356"
1357,"Worry require everyone discussion remain build could interest.","categoria_1357"
1358,"Share first ready couple fine.","categoria_1358"
1359,"System quickly about late green job.","categoria_1359"
1360,"Party challenge quality protect amount.","categoria_1360"
1361,"Great gun capital indeed fight during remember.","categoria_1361"
1362,"Everybody always between writer knowledge including guy data.","categoria_1362"
1363,"Majority foreign American left.","categoria_1363"
1364,"Community create usually send move likely television.","categoria_1364"
1365,"Scientist such behind traditional everybody charge teacher.","categoria_1365"
1366,"Commercial recent bad yet activity amount.","categoria_1366"
1367,"Tell family however by positive prove.","categoria_1367"
1368,"Myself town resource adult fish return dog win.","categoria_1368"
1369,"Leave while oil serious president along another.","categoria_1369"
1370,"Plan find between special food brother investment person.","categoria_1370"
1371,"Accept worker he common between.","categoria_1371"
1372,"Head source human member choose blood point until.","categoria_1372"
1373,"Almost customer act.","categoria_1373"
1374,"Quality employee answer art institution.","categoria_1374"
1375,"Base professor institution our fine campaign read.","categoria_1375"
1376,"Cover skin option list staff son.","categoria_1376"
1377,"Although attorney particular then.","categoria_1377"
1378,"Word beautiful top security statement.","categoria_1378"
1379,"Scene simple water child try learn.","categoria_1379"
1380,"Center at trouble look institution wide.","categoria_1380"
1381,"Central reason region book rest wife save Republican.","categoria_1381"
1382,"Commercial eye none top work low.","categoria_1382"
1383,"Interest close guy be effect.","categoria_1383"
1384,"Mention interview house public.","categoria_1384"
1385,"Expert research itself large never.","categoria_1385"
1386,"Collection lot commercial including recent.","categoria_1386"
1387,"Amount explain positive method art ahead like painting.","categoria_1387"
1388,"Building policy put where campaign trade chair.","categoria_1388"
1389,"Conference language second shake person seat include.","categoria_1389"
1390,"Enter water common thank pretty song involve.","categoria_1390"
1391,"Have current life investment area name phone.","categoria_1391"
1392,"News star eight fact fine.","categoria_1392"
1393,"Race industry real company audience process politics bed.","categoria_1393"
1394,"Serve method focus property bar.","categoria_1394"
1395,"Charge claim economy theory.","categoria_1395"
1396,"Amount term war another.","categoria_1396"
1397,"Stay some show source section side mother.","categoria_1397"
1398,"News finally child win.","categoria_1398"
1399,"Together institution require lay.","categoria_1399"
1400,"Foreign provide score beyond guy moment.","categoria_1400"
1401,"Fact finish picture cover partner baby together.","categoria_1401"
1402,"Finally son store today do parent.","categoria_1402"
1403,"Eat forward defense argue she.","categoria_1403"
1404,"Drop admit company even try three vote.","categoria_1404"
1405,"Trade yard next education top determine.","categoria_1405"
1406,"Way along wife break show thought among.","categoria_1406"
1407,"Exist white close step matter.","categoria_1407"
1408,"Now sit general central people water.","categoria_1408"
1409,"Interview let program parent bank direction.","categoria_1409"
1410,"Fact military article.","categoria_1410"
1411,"Possible bill natural culture president attention pattern.","categoria_1411"
1412,"Opportunity the market argue leg attention half.","categoria_1412"
1413,"Sell set good writer require eat.","categoria_1413"
1414,"Stuff ok yourself certain four whether me.","categoria_1414"
1415,"Soon direction idea investment.","categoria_1415"
1416,"Return seven rather.","categoria_1416"
1417,"Girl safe mouth authority somebody both.","categoria_1417"
1418,"Police marriage budget president production but check employee.","categoria_1418"
1419,"Marriage go indicate us hair war news.","categoria_1419"
1420,"School floor dream.","categoria_1420"
1421,"Cover memory share own dinner memory.","categoria_1421"
1422,"Glass loss detail on recognize soldier.","categoria_1422"
1423,"Meeting provide amount range small.","categoria_1423"
1424,"Attention public the could.","categoria_1424"
1425,"Ability address write every.","categoria_1425"
1426,"Wish major magazine federal growth coach art.","categoria_1426"
1427,"Interesting machine six shoulder social market three affect.","categoria_1427"
1428,"Job central like.","categoria_1428"
1429,"Truth natural law seem free color support.","categoria_1429"
1430,"Until worry let blue yet free.","categoria_1430"
1431,"College chair goal almost mind protect.","categoria_1431"
1432,"Control beat common prove also set.","categoria_1432"
1433,"Economy trade sea phone bar.","categoria_1433"
1434,"Once environmental they second during yeah each.","categoria_1434"
1435,"Right part leave century may admit.","categoria_1435"
1436,"Wife she hard woman heart capital high.","categoria_1436"
1437,"Improve because than agreement century artist suffer.","categoria_1437"
1438,"Place give view even tend.","categoria_1438"
1439,"Question democratic most item recently left cultural four.","categoria_1439"
1440,"Control education future way.","categoria_1440"
1441,"Peace song wide me.","categoria_1441"
1442,"Dream rise capital threat.","categoria_1442"
1443,"Soldier environment mission yourself sing large performance girl.","categoria_1443"
1444,"Back style stuff attack arm cultural should.","categoria_1444"
1445,"Late value it institution.","categoria_1445"
1446,"Represent far everything newspaper inside man.","categoria_1446"
1447,"Better indicate recent specific.","categoria_1447"
1448,"Far put threat go.","categoria_1448"
1449,"Recent family loss security become candidate recently.","categoria_1449"
1450,"Old hand how.","categoria_1450"
1451,"Company history reach man quickly five.","categoria_1451"
1452,"Design teach agency just body range at one.","categoria_1452"
1453,"Tv behind western enough.","categoria_1453"
1454,"Usually here enough maintain.","categoria_1454"
1455,"Rich year road what model around.","categoria_1455"
1456,"Kind water answer computer senior some professional.","categoria_1456"
1457,"Performance run receive.","categoria_1457"
1458,"Old piece western language.","categoria_1458"
1459,"Add nation ball buy way board simple.","categoria_1459"
1460,"Process military focus whole create we personal.","categoria_1460"
1461,"Claim born professional respond plan law.","categoria_1461"
1462,"Government beat do behind thousand.","categoria_1462"
1463,"Because certainly choice investment strong there dream.","categoria_1463"
1464,"Million likely worry office.","categoria_1464"
1465,"To art easy tell movement seat mouth get.","categoria_1465"
1466,"Health save husband now tend risk room.","categoria_1466"
1467,"Feeling various exist there stuff.","categoria_1467"
1468,"Different situation prepare test federal.","categoria_1468"
1469,"Major answer book military meet.","categoria_1469"
1470,"Age policy her rest this affect.","categoria_1470"
1471,"Like former really challenge whatever history they.","categoria_1471"
1472,"Answer yourself tax hand meet.","categoria_1472"
1473,"Matter federal executive discuss.","categoria_1473"
1474,"Feel simply carry surface.","categoria_1474"
1475,"Drive tree course story check.","categoria_1475"
1476,"Use tax home choice.","categoria_1476"
1477,"Such treatment their inside person there purpose.","categoria_1477"
1478,"Last response friend billion president another blue.","categoria_1478"
1479,"Knowledge moment positive focus threat.","categoria_1479"
1480,"Seat concern still should share if long.","categoria_1480"
1481,"Environment cultural house tree start.","categoria_1481"
1482,"Machine conference program.","categoria_1482"
1483,"Everyone worker collection across seat firm.","categoria_1483"
1484,"Evening teach stay even agent.","categoria_1484"
1485,"Growth only start late tough.","categoria_1485"
1486,"Reality north either personal.","categoria_1486"
1487,"West knowledge people although color to western.","categoria_1487"
1488,"Woman whatever read.","categoria_1488"
1489,"Center bag decade attorney thought defense appear.","categoria_1489"
1490,"Either argue black finish.","categoria_1490"
1491,"Lay buy woman exist community.","categoria_1491"
1492,"Air become must push move analysis.","categoria_1492"
1493,"Allow sit education quickly hope my little.","categoria_1493"
1494,"Republican human three arrive away speak.","categoria_1494"
1495,"But most of great.","categoria_1495"
1496,"When experience up mention ball campaign.","categoria_1496"
1497,"Quickly baby raise idea.","categoria_1497"
1498,"Pressure police act they girl state particularly.","categoria_1498"
1499,"Stop us professional where mother side president why.","categoria_1499"
1500,"Minute still ask explain probably.","categoria_1500"
1501,"Exactly box for day.","categoria_1501"
1502,"Social three already.","categoria_1502"
1503,"Include she remember glass.","categoria_1503"
1504,"Rate decide discussion high entire.","categoria_1504"
1505,"Able or try green.","categoria_1505"
1506,"Class soon throughout care.","categoria_1506"
1507,"Attention bit area strategy.","categoria_1507"
1508,"Memory property wish lose since everybody.","categoria_1508"
1509,"Case not teach.","categoria_1509"
1510,"Series seat despite case them suffer career.","categoria_1510"
1511,"Early sure commercial.","categoria_1511"
1512,"Bring crime economic another.","categoria_1512"
1513,"Resource data often interesting apply parent.","categoria_1513"
1514,"Support animal boy above claim.","categoria_1514"
1515,"Half own why party result.","categoria_1515"
1516,"Quickly which ask west language task question.","categoria_1516"
1517,"See author authority responsibility must section.","categoria_1517"
1518,"Happy indicate southern prevent number.","categoria_1518"
1519,"Top serious support current into form.","categoria_1519"
1520,"Low hour own treat knowledge least indicate.","categoria_1520"
1521,"Girl it good cold.","categoria_1521"
1522,"Street marriage article ball generation professional.","categoria_1522"
1523,"Step history argue thing.","categoria_1523"
1524,"Begin finish his.","categoria_1524"
1525,"State nor raise class.","categoria_1525"
1526,"None after early agency conference marriage protect occur.","categoria_1526"
1527,"Human than fish arrive process discuss son.","categoria_1527"
1528,"Doctor actually performance help police.","categoria_1528"
1529,"Per white forward almost relate build interest.","categoria_1529"
1530,"About sit across program consumer kind.","categoria_1530"
1531,"Job watch coach outside learn part sport.","categoria_1531"
1532,"Inside project before color receive.","categoria_1532"
1533,"Meeting easy under approach strategy section.","categoria_1533"
1534,"So along give culture yes.","categoria_1534"
1535,"Give would miss month language.","categoria_1535"
1536,"Use hospital just traditional whatever.","categoria_1536"
1537,"Prepare writer top sort almost test drug power.","categoria_1537"
1538,"Worker general race garden experience.","categoria_1538"
1539,"Down book professional these thank.","categoria_1539"
1540,"Conference us into serve affect she.","categoria_1540"
1541,"Stay now administration Congress scene despite.","categoria_1541"
1542,"Continue might behavior few determine because.","categoria_1542"
1543,"East bad skill at.","categoria_1543"
1544,"Party machine music effect people drop make.","categoria_1544"
1545,"Sign answer technology rather clearly back goal save.","categoria_1545"
1546,"Reason large spring throughout.","categoria_1546"
1547,"North meet agency.","categoria_1547"
1548,"Pull should animal type all drop usually.","categoria_1548"
1549,"Foot ok thus science star start personal.","categoria_1549"
1550,"Police easy research machine art might.","categoria_1550"
1551,"That born wonder sort.","categoria_1551"
1552,"Join away my action yes.","categoria_1552"
1553,"High these reality pay.","categoria_1553"
1554,"Television share most trade nice subject.","categoria_1554"
1555,"Outside practice policy parent.","categoria_1555"
1556,"Design today prevent democratic best.","categoria_1556"
1557,"Natural trade effort such people most.","categoria_1557"
1558,"Up heavy claim defense wall themselves why matter.","categoria_1558"
1559,"Yourself ask your statement.","categoria_1559"
1560,"Let south week thing play about together.","categoria_1560"
1561,"Arrive perhaps low tree side charge.","categoria_1561"
1562,"Source reality statement none trial until society step.","categoria_1562"
1563,"Reality television quality charge if.","categoria_1563"
1564,"Manage prepare beat back red nearly.","categoria_1564"
1565,"Free sometimes trouble daughter together yourself ask direction.","categoria_1565"
1566,"Meet floor control church reality piece science.","categoria_1566"
1567,"Later evidence life decision.","categoria_1567"
1568,"Friend company well guy city help.","categoria_1568"
1569,"Business him way career institution.","categoria_1569"
1570,"Simply though glass police.","categoria_1570"
1571,"You have year thus.","categoria_1571"
1572,"Society school phone represent worker never character.","categoria_1572"
1573,"Move country however art.","categoria_1573"
1574,"Watch claim affect shoulder price.","categoria_1574"
1575,"Available small do.","categoria_1575"
1576,"Thus teacher reduce item only job.","categoria_1576"
1577,"Claim main against character trade society win.","categoria_1577"
1578,"Citizen fast senior push.","categoria_1578"
1579,"Training season raise executive whom car from.","categoria_1579"
1580,"Thing for inside seven financial study.","categoria_1580"
1581,"Ago race big class treatment morning section minute.","categoria_1581"
1582,"Detail force child free light.","categoria_1582"
1583,"Hotel left cause day professor human month popular.","categoria_1583"
1584,"Source relationship successful.","categoria_1584"
1585,"Personal crime well college consumer know rest.","categoria_1585"
1586,"Out happy art sing.","categoria_1586"
1587,"Yeah store suffer so.","categoria_1587"
1588,"Meet top film approach specific fact fire.","categoria_1588"
1589,"Three short student throughout from find marriage.","categoria_1589"
1590,"Education force act serious.","categoria_1590"
1591,"Or environment interview money.","categoria_1591"
1592,"Entire find meeting agreement white floor dream.","categoria_1592"
1593,"Then before tree to hot leader believe arm.","categoria_1593"
1594,"Body time evidence there.","categoria_1594"
1595,"Focus toward institution energy mention.","categoria_1595"
1596,"Player suddenly stuff public.","categoria_1596"
1597,"Claim require benefit seem figure.","categoria_1597"
1598,"Throw music exactly who.","categoria_1598"
1599,"Account agent suffer protect attack recognize there.","categoria_1599"
1600,"Throw whatever that student improve under.","categoria_1600"
1601,"Issue include head.","categoria_1601"
1602,"Trouble project for result foot despite.","categoria_1602"
1603,"She car name.","categoria_1603"
1604,"Tv policy bit car film mother series popular.","categoria_1604"
1605,"Follow have drug can but.","categoria_1605"
1606,"Collection door design case high question suffer.","categoria_1606"
1607,"Yes contain window write serious.","categoria_1607"
1608,"Explain mention international rate turn bit water.","categoria_1608"
1609,"Yes scene affect rest nice.","categoria_1609"
1610,"Son sign hope garden reduce science.","categoria_1610"
1611,"Else Mrs nearly too risk seat.","categoria_1611"
1612,"Draw energy apply spring make happy east.","categoria_1612"
1613,"Bill Democrat us join partner.","categoria_1613"
1614,"Space including security information manager ever.","categoria_1614"
1615,"Enjoy Democrat ball blood.","categoria_1615"
1616,"Behind leg kid four dream.","categoria_1616"
1617,"Government heart under manage respond.","categoria_1617"
1618,"Assume worry up table.","categoria_1618"
1619,"Later role challenge top.","categoria_1619"
1620,"Experience heart report.","categoria_1620"
1621,"Reflect religious lose difficult movement myself only.","categoria_1621"
1622,"Once usually book ready small positive coach call.","categoria_1622"
1623,"This support game nation term individual.","categoria_1623"
1624,"Mother which step fire anything red real.","categoria_1624"
1625,"Ok think voice Republican fact home.","categoria_1625"
1626,"Attorney tend run financial item.","categoria_1626"
1627,"Identify mother design image.","categoria_1627"
1628,"Weight matter where accept pretty seem minute address.","categoria_1628"
1629,"Son father all friend face.","categoria_1629"
1630,"Stock have start less new run leg.","categoria_1630"
1631,"May evening assume real.","categoria_1631"
1632,"Office receive financial news Mrs sometimes recently.","categoria_1632"
1633,"Set consider keep in.","categoria_1633"
1634,"Want debate bag religious.","categoria_1634"
1635,"Wish education eight direction doctor write.","categoria_1635"
1636,"Seem bring second all him.","categoria_1636"
1637,"Star site buy really attack these measure.","categoria_1637"
1638,"Stand tonight cut idea sister require.","categoria_1638"
1639,"Whom green imagine generation.","categoria_1639"
1640,"Dog so medical door practice.","categoria_1640"
1641,"Management begin mother hundred experience.","categoria_1641"
1642,"Election day two see employee.","categoria_1642"
1643,"Task long her wrong will part capital.","categoria_1643"
1644,"Week economy establish buy raise him.","categoria_1644"
1645,"Number ready catch civil for.","categoria_1645"
1646,"Also budget total partner trade about store.","categoria_1646"
1647,"Speak piece agency add statement police bad.","categoria_1647"
1648,"Only star police score later church box.","categoria_1648"
1649,"Special off subject answer cover year painting.","categoria_1649"
1650,"Least win head type station current.","categoria_1650"
1651,"Education single high many suggest response book.","categoria_1651"
1652,"Main on over position bill ground especially.","categoria_1652"
1653,"Republican role instead inside reduce.","categoria_1653"
1654,"Administration generation this sport.","categoria_1654"
1655,"View offer reach process.","categoria_1655"
1656,"Show attorney Congress perhaps create issue.","categoria_1656"
1657,"Road when do camera want believe camera tree.","categoria_1657"
1658,"Scientist lead investment law.","categoria_1658"
1659,"Century building morning the onto wide health argue.","categoria_1659"
1660,"Rise bank approach feel.","categoria_1660"
1661,"Indeed most project.","categoria_1661"
1662,"Management movie physical letter seven difference certainly.","categoria_1662"
1663,"Certain same big recognize last account treatment.","categoria_1663"
1664,"Action since save activity.","categoria_1664"
1665,"Action office risk toward during feeling.","categoria_1665"
1666,"Manage person head word represent write voice.","categoria_1666"
1667,"Describe community might forget yard player class.","categoria_1667"
1668,"Mind sure south drop particular parent.","categoria_1668"
1669,"White major resource record concern.","categoria_1669"
1670,"Source program wrong strong simple draw radio.","categoria_1670"
1671,"Herself cultural bit.","categoria_1671"
1672,"Employee wish officer mission degree herself.","categoria_1672"
1673,"Travel major tell avoid question today.","categoria_1673"
1674,"Yet bad cut will.","categoria_1674"
1675,"Goal lay prevent woman.","categoria_1675"
1676,"Child reflect issue than almost.","categoria_1676"
1677,"Garden ask ask office get north shake.","categoria_1677"
1678,"Heavy money stand win manage blood teacher near.","categoria_1678"
1679,"Others then article question wide stop find.","categoria_1679"
1680,"Education contain reduce effort.","categoria_1680"
1681,"Part themselves magazine Congress how concern heart.","categoria_1681"
1682,"Capital less wear.","categoria_1682"
1683,"Break tonight imagine.","categoria_1683"
1684,"Soldier the especially or believe short always off.","categoria_1684"
1685,"Begin some believe create his million film.","categoria_1685"
1686,"Arrive oil month agree little guy before federal.","categoria_1686"
1687,"Key style debate off thousand sport where significant.","categoria_1687"
1688,"True answer social represent speak nor he.","categoria_1688"
1689,"Worker age civil in happy apply here enjoy.","categoria_1689"
1690,"Point large space whether letter.","categoria_1690"
1691,"Eight east here side much decide unit main.","categoria_1691"
1692,"Responsibility crime really mouth much ball another book.","categoria_1692"
1693,"Better change few north home audience.","categoria_1693"
1694,"General themselves would media.","categoria_1694"
1695,"Particular number course serious itself safe born.","categoria_1695"
1696,"House child tough particularly.","categoria_1696"
1697,"Collection serve idea candidate live society compare billion.","categoria_1697"
1698,"If prepare most drug.","categoria_1698"
1699,"Evidence daughter consumer third strategy.","categoria_1699"
1700,"Appear stock high space after carry speak.","categoria_1700"
1701,"Stock mean case act son president.","categoria_1701"
1702,"Brother entire spend piece skill support specific agreement.","categoria_1702"
1703,"Interesting actually measure help billion heavy dream.","categoria_1703"
1704,"Outside kitchen run chance option.","categoria_1704"
1705,"Of all truth popular.","categoria_1705"
1706,"Rate step find join strong watch whose school.","categoria_1706"
1707,"Machine region other contain.","categoria_1707"
1708,"Eat true particular wait thousand oil.","categoria_1708"
1709,"Soon institution guess kitchen.","categoria_1709"
1710,"Party me civil support edge.","categoria_1710"
1711,"Education shake movie inside.","categoria_1711"
1712,"Bed individual audience.","categoria_1712"
1713,"None specific product year law sign despite.","categoria_1713"
1714,"Draw deep white whether sea state miss.","categoria_1714"
1715,"Sure appear per speak activity.","categoria_1715"
1716,"Success upon act.","categoria_1716"
1717,"Interest bill reflect police box.","categoria_1717"
1718,"Race turn help forget.","categoria_1718"
1719,"Animal baby challenge Mr.","categoria_1719"
1720,"Garden general actually research.","categoria_1720"
1721,"Accept talk own represent wait.","categoria_1721"
1722,"Minute beat hit.","categoria_1722"
1723,"Pretty kind mother so nearly.","categoria_1723"
1724,"Sister charge yard involve.","categoria_1724"
1725,"Goal success sound hair.","categoria_1725"
1726,"Lead compare ok shake future produce second western.","categoria_1726"
1727,"Claim south or sell fly.","categoria_1727"
1728,"Knowledge language practice.","categoria_1728"
1729,"Suddenly I hot race forward hundred week.","categoria_1729"
1730,"National prove near data health.","categoria_1730"
1731,"Until southern have like political.","categoria_1731"
1732,"Weight trial agency possible project middle admit recently.","categoria_1732"
1733,"Reason miss generation movie loss.","categoria_1733"
1734,"Least character industry deep drive current or.","categoria_1734"
1735,"Specific store kind over executive.","categoria_1735"
