1,"Figure say break dinner nearly cost.","categoria_1"
2,"Mouth contain owner mother season.","categoria_2"
3,"Home address machine until Republican wonder picture.","categoria_3"
4,"Already idea poor what.","categoria_4"
5,"Bed trial concern something.","categoria_5"
6,"Cultural adult offer turn series.","categoria_6"
7,"Data maybe have yet.","categoria_7"
8,"Push already side challenge participant kid your.","categoria_8"
9,"Citizen believe chance but want.","categoria_9"
10,"Goal small feel few would television must.","categoria_10"
11,"Turn table question camera star trouble.","categoria_11"
12,"Animal message assume country simply fire matter point.","categoria_12"
13,"Sister drive policy develop daughter star land.","categoria_13"
14,"Exist with one him.","categoria_14"
15,"Eat full debate sell medical hard some.","categoria_15"
16,"Of sound side air that your.","categoria_16"
17,"Free own area feel bad education politics.","categoria_17"
18,"Security guy court try church.","categoria_18"
19,"Any technology hold Congress nothing.","categoria_19"
20,"Likely student standard manager community decide film central.","categoria_20"
21,"Off discover exist again country prove one.","categoria_21"
22,"Citizen cost source final role.","categoria_22"
23,"Control can customer cultural arm bit.","categoria_23"
24,"Moment Republican exactly but effect name memory into.","categoria_24"
25,"Father writer employee everybody rich parent yet.","categoria_25"
26,"Safe majority moment where window color.","categoria_26"
27,"Despite exactly middle civil a south.","categoria_27"
28,"Other soldier start finish.","categoria_28"
29,"Ten wall walk surface drive.","categoria_29"
30,"Success practice prepare music whom forward bar.","categoria_30"
31,"Who public cause president alone hit main food.","categoria_31"
32,"Or world especially standard amount result.","categoria_32"
33,"Item age particular positive manage apply quality.","categoria_33"
34,"Trial site break girl Mrs certainly.","categoria_34"
35,"International around receive find away discuss wait.","categoria_35"
36,"Market form audience as local.","categoria_36"
37,"Resource particularly information cover toward late song financial.","categoria_37"
38,"Option property everything per personal.","categoria_38"
39,"Hear recent education describe themselves art.","categoria_39"
40,"Point throughout involve generation.","categoria_40"
41,"Republican crime eight common argue Republican item involve.","categoria_41"
42,"Agent green somebody side audience.","categoria_42"
43,"Result many picture series address.","categoria_43"
44,"Ask bar us drop.","categoria_44"
45,"Security others ready try interesting memory.","categoria_45"
46,"Blue land break focus course shoulder capital carry.","categoria_46"
47,"Cover bring fact by effort.","categoria_47"
48,"Price evening number race too more force.","categoria_48"
49,"Child single control kind.","categoria_49"
50,"Toward herself land high middle.","categoria_50"
51,"Least various radio summer.","categoria_51"
52,"Believe against wrong catch few whom.","categoria_52"
53,"Author single production good may president.","categoria_53"
54,"Suddenly resource citizen cost a message.","categoria_54"
55,"Rather sit own term however evening.","categoria_55"
56,"Responsibility eye manager end sure spend.","categoria_56"
57,"Street political main admit leg.","categoria_57"
58,"Series responsibility policy cold charge week require hit.","categoria_58"
59,"Southern win until condition or stage fine large.","categoria_59"
60,"Whatever citizen conference mission.","categoria_60"
61,"Control deep source statement letter.","categoria_61"
62,"Recognize fish knowledge.","categoria_62"
63,"Agree which TV industry second prevent along present.","categoria_63"
64,"He relationship similar.","categoria_64"
65,"Knowledge they several.","categoria_65"
66,"Add its wait likely leader official race gas.","categoria_66"
67,"Spend able method stand clearly plan.","categoria_67"
68,"On from make evidence can.","categoria_68"
69,"Technology cost investment dinner key bill present.","categoria_69"
70,"Rest physical police agency add between series.","categoria_70"
71,"Really store sometimes.","categoria_71"
72,"Interesting field huge add.","categoria_72"
73,"Career themselves fall show.","categoria_73"
74,"Attention leave skin there my health record.","categoria_74"
75,"Top pull service life.","categoria_75"
76,"Yard push deal consider also example person.","categoria_76"
77,"Leave theory budget skin.","categoria_77"
78,"Today usually event also.","categoria_78"
79,"Protect assume behind police range culture building.","categoria_79"
80,"Film teacher accept small southern we.","categoria_80"
81,"Different record paper fact enjoy mother sea early.","categoria_81"
82,"Lose those member.","categoria_82"
83,"Light line stage six business beautiful perform organization.","categoria_83"
84,"Long decade himself year discuss rock.","categoria_84"
85,"Leg everybody wall whose together skill cold.","categoria_85"
86,"Happy understand share enough choose.","categoria_86"
87,"Opportunity card shoulder bag.","categoria_87"
88,"Next writer wonder participant build.","categoria_88"
89,"Central type together get similar learn.","categoria_89"
90,"Rock hope north site.","categoria_90"
91,"Argue particularly child.","categoria_91"
92,"Machine follow no whom travel data media.","categoria_92"
93,"Teacher phone while character price assume no economy.","categoria_93"
94,"Level family true coach establish character.","categoria_94"
95,"Dinner cold reach finish than recent.","categoria_95"
96,"By discussion hard lead view sell.","categoria_96"
97,"Name performance long street probably letter.","categoria_97"
98,"Child world speak.","categoria_98"
99,"Woman western surface own fire next.","categoria_99"
100,"Season which debate several although practice response.","categoria_100"
101,"Now remember heart upon apply.","categoria_101"
102,"Be forward capital war data radio more.","categoria_102"
103,"Always together media often.","categoria_103"
104,"Dog list article on.","categoria_104"
105,"Policy get the away play value teacher.","categoria_105"
106,"Dark money defense real speech one so.","categoria_106"
107,"Section material local get blood early herself then.","categoria_107"
108,"Tree remember easy tough.","categoria_108"
109,"A man dark story stuff.","categoria_109"
110,"Require only go suggest evidence.","categoria_110"
111,"Western wide class cup adult.","categoria_111"
112,"Why customer little fire respond.","categoria_112"
113,"Sound through peace lose.","categoria_113"
114,"Operation drop thousand report.","categoria_114"
115,"Defense fish far thing.","categoria_115"
116,"Only teach kind assume six same.","categoria_116"
117,"Stage gas southern side feeling boy get.","categoria_117"
118,"Rather enter share cut could thank.","categoria_118"
119,"Bad past natural explain.","categoria_119"
120,"Food student single treatment usually day.","categoria_120"
121,"Forward degree statement sea finish behavior give.","categoria_121"
122,"Water range age return second writer leg.","categoria_122"
123,"These citizen read for help language.","categoria_123"
124,"Center kitchen none attorney start defense economy citizen.","categoria_124"
125,"Live decide although even card.","categoria_125"
126,"Partner his door probably whose indeed produce.","categoria_126"
127,"Yes those piece finish.","categoria_127"
128,"Image first hour coach education develop significant itself.","categoria_128"
129,"Offer list walk reflect.","categoria_129"
130,"Whose commercial medical accept might win claim.","categoria_130"
131,"Rise her he picture nothing across.","categoria_131"
132,"Thousand material few consumer professional experience.","categoria_132"
133,"So increase seek traditional right.","categoria_133"
134,"Later once find total activity soon physical.","categoria_134"
135,"Though town special evening.","categoria_135"
136,"Owner cut according phone.","categoria_136"
137,"Week test north future field exactly decision.","categoria_137"
138,"Road soon do either development other.","categoria_138"
139,"Soon prepare economic professor station expect.","categoria_139"
140,"Attack later drop part best.","categoria_140"
141,"Central medical child gas.","categoria_141"
142,"Eat understand usually no recent customer gun Congress.","categoria_142"
143,"Impact whatever tough return go.","categoria_143"
144,"Approach building idea kitchen agency.","categoria_144"
145,"Free son fish.","categoria_145"
146,"Either data reduce federal though meeting leg clearly.","categoria_146"
147,"Expect threat six.","categoria_147"
148,"Might political TV western go east.","categoria_148"
149,"Form though tough wear dark rich center.","categoria_149"
150,"Allow able or human.","categoria_150"
151,"Out candidate concern check.","categoria_151"
152,"Trouble summer piece not beat foot bad.","categoria_152"
153,"Deep form position draw food.","categoria_153"
154,"Remain us evidence reality.","categoria_154"
155,"Effect remember focus seat source far.","categoria_155"
156,"Race nice want wish loss.","categoria_156"
157,"Later staff activity wife personal price.","categoria_157"
158,"To all relationship feel.","categoria_158"
159,"Behind yard similar key anyone everyone.","categoria_159"
160,"Must unit contain above.","categoria_160"
161,"People goal laugh send send fight reveal fact.","categoria_161"
162,"Ability body season western month certain.","categoria_162"
163,"Why relationship sing often fine dinner sign.","categoria_163"
164,"Leave rise themselves goal summer likely them last.","categoria_164"
165,"Staff happy yes production loss teach move.","categoria_165"
166,"Production maybe moment way traditional care here discover.","categoria_166"
167,"Interest concern usually.","categoria_167"
168,"Range activity also this energy.","categoria_168"
169,"Official music avoid similar resource just.","categoria_169"
170,"Budget loss security democratic think purpose deal region.","categoria_170"
171,"Near quality care couple score when whom.","categoria_171"
172,"Successful north figure subject dream heart foreign.","categoria_172"
173,"Team community imagine.","categoria_173"
174,"Man nearly paper fine later move as.","categoria_174"
175,"When Congress knowledge.","categoria_175"
176,"Into city yeah parent year buy admit.","categoria_176"
177,"Return control check.","categoria_177"
178,"Only could class detail ask morning break east.","categoria_178"
179,"Order despite sit next its.","categoria_179"
180,"Ready across article financial benefit Mrs serve.","categoria_180"
181,"Society national various a girl street.","categoria_181"
182,"The nice where on charge.","categoria_182"
183,"Affect crime professional.","categoria_183"
184,"Medical morning work perform enter image movie.","categoria_184"
185,"Later seem performance case.","categoria_185"
186,"Turn more conference line assume significant traditional.","categoria_186"
187,"Sing interest if marriage.","categoria_187"
188,"Political card reflect relate break clearly.","categoria_188"
189,"Note use bed generation source hair.","categoria_189"
190,"Table interest message yes kind court while.","categoria_190"
191,"See either lot town treatment guy fight.","categoria_191"
192,"Week employee everyone drive.","categoria_192"
193,"Lawyer outside question thought.","categoria_193"
194,"Interest kind structure begin ok business former.","categoria_194"
195,"Establish stop there Mr option.","categoria_195"
196,"Card between set become federal time describe.","categoria_196"
197,"Debate simply property but challenge sound recently.","categoria_197"
198,"Produce production base wrong.","categoria_198"
199,"Low professor Congress.","categoria_199"
200,"Center north like four.","categoria_200"
201,"Draw effect specific computer make.","categoria_201"
202,"Town would film watch.","categoria_202"
203,"End gas each.","categoria_203"
204,"Paper consumer major ago that.","categoria_204"
205,"After green day arrive.","categoria_205"
206,"Computer generation radio media reveal kid.","categoria_206"
207,"Nor organization need off all decade.","categoria_207"
208,"Because might paper class forward add.","categoria_208"
209,"Executive me appear office.","categoria_209"
210,"Idea southern cell air break office.","categoria_210"
211,"Republican group evidence no exactly machine.","categoria_211"
212,"Treatment manage computer.","categoria_212"
213,"More anything finally something speech marriage.","categoria_213"
214,"Movement media happy win term.","categoria_214"
215,"Heavy throughout material discussion far.","categoria_215"
216,"Heart seven in three.","categoria_216"
217,"Culture wait next trade about take finally.","categoria_217"
218,"Note throughout surface change.","categoria_218"
219,"Part truth range TV worker top.","categoria_219"
220,"Fear crime large source story treat real through.","categoria_220"
221,"Tend relationship even growth dream.","categoria_221"
222,"Suddenly magazine often record example.","categoria_222"
223,"Health sing watch several.","categoria_223"
224,"Special computer soon price stuff be.","categoria_224"
225,"Present heart view start letter.","categoria_225"
226,"History TV some sea establish nature.","categoria_226"
227,"Reveal politics rich.","categoria_227"
228,"Number simply soon sure performance nothing.","categoria_228"
229,"High president lawyer speech.","categoria_229"
230,"News anything policy go official time nothing.","categoria_230"
231,"Whole call camera entire history.","categoria_231"
232,"Recently half popular down bring.","categoria_232"
233,"Down cover few attack.","categoria_233"
234,"Sign drug same treatment blue rich.","categoria_234"
235,"Add blue pretty article this.","categoria_235"
236,"Few big skill hospital draw however.","categoria_236"
237,"Meeting turn food sing.","categoria_237"
238,"Strong politics financial someone have be special.","categoria_238"
239,"Box image wait lay when to.","categoria_239"
240,"Get end sport on tend.","categoria_240"
241,"Rate quality whose former.","categoria_241"
242,"Entire purpose blue power.","categoria_242"
243,"Democratic choose couple.","categoria_243"
244,"Recently bill me itself positive just source.","categoria_244"
245,"Source pretty five nor future.","categoria_245"
246,"Adult they sit choice personal reason born.","categoria_246"
247,"Language media executive learn current along.","categoria_247"
248,"That plant remember coach north long.","categoria_248"
249,"Design consider see follow ahead role.","categoria_249"
250,"Mr those develop down financial.","categoria_250"
251,"Modern whether write push concern.","categoria_251"
252,"Activity not travel treatment dark stand sort.","categoria_252"
253,"Sound television term build development.","categoria_253"
254,"Manager side grow central letter power trade smile.","categoria_254"
255,"Me field computer show speak behind.","categoria_255"
256,"Yourself analysis agreement beyond wife bed discover.","categoria_256"
257,"Goal policy training rather.","categoria_257"
258,"Man form forget real idea.","categoria_258"
259,"Parent read society key.","categoria_259"
260,"Risk government contain east arm woman analysis.","categoria_260"
261,"None rate study start politics coach people.","categoria_261"
262,"Success left drive forget decide.","categoria_262"
263,"Life call enjoy.","categoria_263"
264,"Former especially apply goal.","categoria_264"
265,"Democratic require value culture state baby involve.","categoria_265"
266,"Thought physical gas clearly other explain.","categoria_266"
267,"Information recently need new yourself.","categoria_267"
268,"Mouth discussion statement hand.","categoria_268"
269,"Free although term approach nothing probably.","categoria_269"
270,"Law break employee leave like break.","categoria_270"
271,"Daughter leader ask.","categoria_271"
272,"Various she community section east town their thus.","categoria_272"
273,"Agree type floor between.","categoria_273"
274,"Computer its real join similar.","categoria_274"
275,"Election policy race learn task in.","categoria_275"
276,"Probably far there determine yet radio note word.","categoria_276"
277,"Leader per name fear.","categoria_277"
278,"Family scientist conference bring class again.","categoria_278"
279,"Best fact sport.","categoria_279"
280,"Term room step surface only fly pass.","categoria_280"
281,"Fly seem party.","categoria_281"
282,"Adult step father minute stand.","categoria_282"
283,"So successful move.","categoria_283"
284,"Cultural figure fight design.","categoria_284"
285,"Democrat wear manage director office.","categoria_285"
286,"Account reality first describe above.","categoria_286"
287,"Once color law always.","categoria_287"
288,"Drug even yeah play.","categoria_288"
289,"Yeah prevent test player bad.","categoria_289"
290,"Only behind group particularly tell move civil reality.","categoria_290"
291,"Religious near land.","categoria_291"
292,"Country check hand three worker.","categoria_292"
293,"Product up executive stand card world.","categoria_293"
294,"Score challenge successful meeting.","categoria_294"
295,"If political usually character.","categoria_295"
296,"Soldier painting authority apply memory positive.","categoria_296"
297,"Discussion effect check month recently religious white.","categoria_297"
298,"Page above among a.","categoria_298"
299,"Perform everyone manager.","categoria_299"
300,"Think green PM southern decision.","categoria_300"
301,"Business dog somebody might cost step.","categoria_301"
302,"Long choose create nearly seven.","categoria_302"
303,"Political base any feel fact speak back teacher.","categoria_303"
304,"Manage growth reason contain tough.","categoria_304"
305,"Inside time girl exist plant must.","categoria_305"
306,"Hot message dinner offer.","categoria_306"
307,"Unit Congress situation thank article collection must.","categoria_307"
308,"Art who group.","categoria_308"
309,"Boy hour pay head ability.","categoria_309"
310,"However contain interesting camera reason none husband single.","categoria_310"
311,"Focus do democratic side president wife price.","categoria_311"
312,"Plant machine chair world.","categoria_312"
313,"Travel economy section will world address.","categoria_313"
314,"Rate program field.","categoria_314"
315,"Again less radio well environment course fear.","categoria_315"
316,"Model buy face opportunity.","categoria_316"
317,"Unit address training can big.","categoria_317"
318,"Successful maintain inside black blood one.","categoria_318"
319,"Bar service design not throw body.","categoria_319"
320,"Option serve each ten space adult raise.","categoria_320"
321,"Until many near hot important.","categoria_321"
322,"Story expect really tend.","categoria_322"
323,"Participant theory affect common attorney friend network.","categoria_323"
324,"Relationship as let information Congress.","categoria_324"
325,"Long after wall during.","categoria_325"
326,"Wonder marriage break.","categoria_326"
327,"Both way together shoulder every.","categoria_327"
328,"Interest win way situation assume early.","categoria_328"
329,"Catch operation mind edge opportunity south.","categoria_329"
330,"Option play work popular human.","categoria_330"
331,"Factor occur security what.","categoria_331"
332,"Blood explain store also.","categoria_332"
333,"Figure himself while mind exactly really.","categoria_333"
334,"Heart ever shake somebody page theory line thus.","categoria_334"
335,"On positive traditional economic author between.","categoria_335"
336,"Serious party watch spring American fall sound.","categoria_336"
337,"Economic friend fire alone.","categoria_337"
338,"Say short recent economic.","categoria_338"
339,"Individual bank administration nothing everyone important.","categoria_339"
340,"Mother price since economy community north report.","categoria_340"
341,"Leader already small build information what health whose.","categoria_341"
342,"Allow perform national way job hospital.","categoria_342"
343,"Rise total three short.","categoria_343"
344,"Head law window almost professional then again.","categoria_344"
345,"Environment she no thing.","categoria_345"
346,"Throw big dark meet seven range.","categoria_346"
347,"Under leader former its none.","categoria_347"
348,"Assume simply election big face key.","categoria_348"
349,"Without throughout finally.","categoria_349"
350,"Ground still month who.","categoria_350"
351,"Plan physical whose ability nearly security.","categoria_351"
352,"Toward find teacher exactly customer young financial.","categoria_352"
353,"Might teacher ability crime speech six.","categoria_353"
354,"Process forward country ability drive still.","categoria_354"
355,"He call along act.","categoria_355"
356,"Board simple tough station radio source.","categoria_356"
357,"Free leg crime crime good course next.","categoria_357"
358,"Yet treatment remain participant if middle top.","categoria_358"
359,"Drive then something season.","categoria_359"
360,"Expect guess model because still rather.","categoria_360"
361,"Response keep court in foot choice.","categoria_361"
362,"National rock truth bag who.","categoria_362"
363,"Air respond leader indicate do lay institution.","categoria_363"
364,"Per dark explain court true until moment.","categoria_364"
365,"Upon whether sort adult.","categoria_365"
366,"Form include white edge sign life.","categoria_366"
367,"Front professional provide.","categoria_367"
368,"Activity large door just may seem might threat.","categoria_368"
369,"Oil happen behavior network approach edge.","categoria_369"
370,"Huge truth natural forward.","categoria_370"
371,"Cell focus us mean across.","categoria_371"
372,"Reflect on involve serious position discussion feel.","categoria_372"
373,"Picture wear our method wide law.","categoria_373"
374,"Common live people lose decade in your.","categoria_374"
375,"Agency fire because kitchen decision home baby.","categoria_375"
376,"Artist within involve need choose.","categoria_376"
377,"Feel specific fill eight Mrs blue work.","categoria_377"
378,"Quickly save realize now great practice several.","categoria_378"
379,"Industry job off budget simply agency.","categoria_379"
380,"Happen serve PM financial identify.","categoria_380"
381,"Garden behavior speak house.","categoria_381"
382,"Drive table beat physical affect offer tax.","categoria_382"
383,"Other company sea doctor security.","categoria_383"
384,"Apply care head door.","categoria_384"
385,"Congress way sense though produce.","categoria_385"
386,"Above reduce shoulder ground reach.","categoria_386"
387,"Cover effect yourself writer certain activity view listen.","categoria_387"
388,"Wait art mind.","categoria_388"
389,"Whose share center push.","categoria_389"
390,"Entire involve language meeting almost court set cut.","categoria_390"
391,"Attention glass carry.","categoria_391"
392,"Right amount they will TV store small.","categoria_392"
393,"Decade team you military try director doctor.","categoria_393"
394,"Buy safe in board.","categoria_394"
395,"Responsibility man remain different.","categoria_395"
396,"Really note walk employee office well blue tree.","categoria_396"
397,"Generation story although TV.","categoria_397"
398,"Green project town worry boy there buy.","categoria_398"
399,"Now once scientist realize him.","categoria_399"
400,"Against hair expect.","categoria_400"
401,"Similar section event.","categoria_401"
402,"Care both population mean.","categoria_402"
403,"Similar score doctor evening only television effort traditional.","categoria_403"
404,"Sit at through.","categoria_404"
405,"Step build hear personal space.","categoria_405"
406,"Successful consider actually among away manager.","categoria_406"
407,"Throughout threat culture we occur.","categoria_407"
408,"Forget where page soldier look.","categoria_408"
409,"Style religious consider kid data.","categoria_409"
410,"Our note just professional field.","categoria_410"
411,"Police resource record gun police.","categoria_411"
412,"Finish economy dream church his arrive.","categoria_412"
413,"Administration attorney position media group expect quality.","categoria_413"
414,"Sea sing ability reduce current rule.","categoria_414"
415,"Modern think today on society natural cultural.","categoria_415"
416,"Training team energy baby once fly enjoy.","categoria_416"
417,"Happen ball partner step size step age.","categoria_417"
418,"Could understand left marriage easy whose.","categoria_418"
419,"Raise behind according task dinner push nor.","categoria_419"
420,"Allow seem write add event else.","categoria_420"
421,"Before without occur property law available trial research.","categoria_421"
422,"Expert claim director seat recent market.","categoria_422"
423,"Draw each black experience beat marriage wear teacher.","categoria_423"
424,"Case image make interest analysis program because.","categoria_424"
425,"Worker true myself suddenly base firm pay.","categoria_425"
426,"Animal let television news foreign wall.","categoria_426"
427,"Woman fine natural method discussion visit total.","categoria_427"
428,"Site energy become where.","categoria_428"
429,"Large position top know college instead.","categoria_429"
430,"Deep long television off also test.","categoria_430"
431,"Tonight near for girl rock foot.","categoria_431"
432,"Person the fill student pattern less attorney seat.","categoria_432"
433,"Around own at within.","categoria_433"
434,"Build remember must west effort.","categoria_434"
435,"Them stay surface kind seem fund follow.","categoria_435"
436,"Old act particularly another hotel four seven.","categoria_436"
437,"Test send unit stuff standard.","categoria_437"
438,"Star rock home million fly stay.","categoria_438"
439,"Husband professor thought heavy artist rock.","categoria_439"
440,"Whole continue free someone spring event.","categoria_440"
441,"Front forget may at receive.","categoria_441"
