442,"Money left determine none.","categoria_442"
443,"Throughout mention away edge still rule sister.","categoria_443"
444,"Sing quality director interesting nothing.","categoria_444"
445,"Half change cut movement they analysis black.","categoria_445"
446,"Either heavy baby.","categoria_446"
447,"Keep book expert act.","categoria_447"
448,"Raise force answer war likely agency senior.","categoria_448"
449,"With visit wait.","categoria_449"
450,"Find firm administration either field deep.","categoria_450"
451,"Determine letter history I tax approach language professor.","categoria_451"
452,"Democratic soon lawyer first senior wish item.","categoria_452"
453,"Purpose window three produce something summer role.","categoria_453"
454,"Power now type effect system.","categoria_454"
455,"Office central claim lose.","categoria_455"
456,"Successful six send buy.","categoria_456"
457,"Budget up yet across performance.","categoria_457"
458,"Full there me concern.","categoria_458"
459,"Car see same long.","categoria_459"
460,"End change put campaign fund.","categoria_460"
461,"War school wait.","categoria_461"
462,"Language job account health indeed.","categoria_462"
463,"Next result book show simply always strong shake.","categoria_463"
464,"Task day see someone event forget.","categoria_464"
465,"Though energy shoulder fund word loss matter.","categoria_465"
466,"Central customer article.","categoria_466"
467,"Imagine me sometimes ten shake positive.","categoria_467"
468,"Pick us upon amount piece.","categoria_468"
469,"Song no strong door state though personal.","categoria_469"
470,"Quickly significant five realize.","categoria_470"
471,"After friend activity ability lot approach.","categoria_471"
472,"Food wide born west.","categoria_472"
473,"Law half nor play sport her.","categoria_473"
474,"Red role style rate figure everybody.","categoria_474"
475,"Explain once friend dog similar Mr morning.","categoria_475"
476,"Final memory particular rather pass.","categoria_476"
477,"High develop pass machine run describe.","categoria_477"
478,"Discover skill set at next look other.","categoria_478"
479,"Development oil half democratic majority type.","categoria_479"
480,"Most hear several yet account really.","categoria_480"
481,"Soon watch white new first provide change.","categoria_481"
482,"At store customer four there act not.","categoria_482"
483,"Degree support back participant debate.","categoria_483"
484,"Business suddenly this last.","categoria_484"
485,"Ground back rock close rich from.","categoria_485"
486,"Office network visit thank.","categoria_486"
487,"Type shoulder pick leave picture also.","categoria_487"
488,"Control its data candidate form environment individual.","categoria_488"
489,"Success direction wear forward.","categoria_489"
490,"Call it school body develop small.","categoria_490"
491,"Join well season cup today.","categoria_491"
492,"Herself tend hold politics young difficult.","categoria_492"
493,"Couple seek chance.","categoria_493"
494,"Dinner hold source environment husband road.","categoria_494"
495,"Writer teach so nation probably me simple.","categoria_495"
496,"Rule a true else raise site customer enter.","categoria_496"
497,"Deep imagine build simple now.","categoria_497"
498,"Control economic future benefit site edge economy close.","categoria_498"
499,"Up local law tend along choose according.","categoria_499"
500,"Along long speech lot decision what decade.","categoria_500"
501,"Stand sea stage worker trouble oil anyone.","categoria_501"
502,"Personal recognize know all church.","categoria_502"
503,"Such throughout hand.","categoria_503"
504,"Specific sister two blue.","categoria_504"
505,"Article cell important rest campaign report once consumer.","categoria_505"
506,"Factor peace Mr news officer also.","categoria_506"
507,"Kitchen newspaper present entire.","categoria_507"
508,"Write week why box provide show evening anything.","categoria_508"
509,"Difficult your energy finally.","categoria_509"
510,"Poor though mention man strategy.","categoria_510"
511,"Behavior discussion bill thought state necessary message.","categoria_511"
512,"Certain ground pick natural baby success.","categoria_512"
513,"Mention so finish better.","categoria_513"
514,"Current early reduce hour morning big friend.","categoria_514"
515,"Window door miss.","categoria_515"
516,"Low minute example ready kind decide develop.","categoria_516"
517,"Smile kind still across example ask.","categoria_517"
518,"Organization staff play night hair.","categoria_518"
519,"Partner teach or party everything.","categoria_519"
520,"Little trade ask continue hair.","categoria_520"
521,"Top employee prepare fight hotel kitchen total.","categoria_521"
522,"Trial ago sort cold trial kind wrong.","categoria_522"
523,"Health professor employee include toward product knowledge.","categoria_523"
524,"Born contain under.","categoria_524"
525,"Statement get include with training.","categoria_525"
526,"Paper front help city treatment.","categoria_526"
527,"Goal pull something for according.","categoria_527"
528,"Result population and long visit.","categoria_528"
529,"Think attack southern crime.","categoria_529"
530,"World both read administration range once future.","categoria_530"
531,"Who sometimes after while determine six.","categoria_531"
532,"Build its western position ten.","categoria_532"
533,"Local loss star field close or.","categoria_533"
534,"Fact throughout network second certain.","categoria_534"
535,"Or nor onto executive let bag factor hotel.","categoria_535"
536,"Point industry during miss himself success.","categoria_536"
537,"Child plan stand outside think year.","categoria_537"
538,"Drive skill hear young answer authority.","categoria_538"
539,"Yard surface unit security.","categoria_539"
540,"Significant bag guy realize meeting.","categoria_540"
541,"Every picture debate particular.","categoria_541"
542,"Military fine environmental hand.","categoria_542"
543,"Allow fear security respond.","categoria_543"
544,"Able Mr light whatever.","categoria_544"
545,"Laugh democratic our new agree into sea letter.","categoria_545"
546,"Their late economic arm or glass best.","categoria_546"
547,"Raise clear say chair ahead stop.","categoria_547"
548,"List itself around especially.","categoria_548"
549,"Save force region improve question wife American.","categoria_549"
550,"Production someone image finally national.","categoria_550"
551,"Officer use white impact present sure natural.","categoria_551"
552,"Cover discover job every candidate issue receive eye.","categoria_552"
553,"Program window lay simple least.","categoria_553"
554,"Single kid research rock nearly.","categoria_554"
555,"Party exist might deep office reality culture.","categoria_555"
556,"Brother remember fine.","categoria_556"
557,"Which general police enjoy stand forward still.","categoria_557"
558,"Into cause red would.","categoria_558"
559,"Arm leader nor reduce hard growth past suggest.","categoria_559"
560,"Fill building race lead great.","categoria_560"
561,"Around visit culture threat fast.","categoria_561"
562,"Three put agent.","categoria_562"
563,"Song foot left.","categoria_563"
564,"Tree only rich down art operation pick have.","categoria_564"
565,"Fund so positive do.","categoria_565"
566,"See service suffer gas often I.","categoria_566"
567,"Military possible week tell true.","categoria_567"
568,"Use central station man much budget church.","categoria_568"
569,"Like a water event people.","categoria_569"
570,"Scientist clear school any experience PM.","categoria_570"
571,"We window appear add fish old boy candidate.","categoria_571"
572,"Health behind something type include culture avoid road.","categoria_572"
573,"On could seek Congress watch.","categoria_573"
574,"Professor region though reason fact evidence inside.","categoria_574"
575,"Look for now beat.","categoria_575"
576,"Bed factor commercial four level long sing.","categoria_576"
577,"Less central feel sing.","categoria_577"
578,"Can walk somebody.","categoria_578"
579,"Response send clearly.","categoria_579"
580,"Soldier we available environmental Congress.","categoria_580"
581,"Compare act theory program loss.","categoria_581"
582,"Practice level center popular.","categoria_582"
583,"Politics man stay.","categoria_583"
584,"Interview worry traditional a.","categoria_584"
585,"Coach worry month young agreement star.","categoria_585"
586,"Wonder report although fine.","categoria_586"
587,"Star treat most late yourself look find create.","categoria_587"
588,"Brother development decision positive.","categoria_588"
589,"Prepare decade task five next.","categoria_589"
590,"Campaign read exist over.","categoria_590"
591,"Network especially air attention best expert have prepare.","categoria_591"
592,"Tonight follow where lose fill avoid last.","categoria_592"
593,"Local morning star those fund happy seven.","categoria_593"
594,"Keep talk everyone south.","categoria_594"
595,"Head soon how chair most down and drop.","categoria_595"
596,"Forget interesting once detail economic then difference.","categoria_596"
597,"Reflect another first interest.","categoria_597"
598,"Top hold tonight gas price later technology.","categoria_598"
599,"Decide sea deep everyone environmental.","categoria_599"
600,"White program rather time feel.","categoria_600"
601,"Head decide available song so.","categoria_601"
602,"Career hit they even.","categoria_602"
603,"Avoid dinner keep would.","categoria_603"
604,"Break ok business opportunity left.","categoria_604"
605,"Go senior address Republican each store.","categoria_605"
606,"Natural score sport new.","categoria_606"
607,"Buy worker protect they.","categoria_607"
608,"Least big space degree.","categoria_608"
609,"Bank fall alone.","categoria_609"
610,"Report decision three century film within feel where.","categoria_610"
611,"Article turn thus better people number easy.","categoria_611"
612,"Because fire raise north service.","categoria_612"
613,"Clear individual structure while artist.","categoria_613"
614,"Unit first quality according.","categoria_614"
615,"Hold low list out party speech.","categoria_615"
616,"Why follow small each support station.","categoria_616"
617,"Ask far always in.","categoria_617"
618,"Or before action tend keep live begin.","categoria_618"
619,"Prove tell door play lose account red.","categoria_619"
620,"Cultural current model that cultural.","categoria_620"
621,"Time whose my low detail.","categoria_621"
622,"Specific become month night between choice lose.","categoria_622"
623,"Week suffer cause.","categoria_623"
624,"Though price color including media director.","categoria_624"
625,"Consider everyone executive although.","categoria_625"
626,"Process side put fly even so politics.","categoria_626"
627,"Business something significant one agree natural left.","categoria_627"
628,"Their safe quality.","categoria_628"
629,"Voice boy low partner must visit.","categoria_629"
630,"Really create two that.","categoria_630"
631,"When teach tend analysis.","categoria_631"
632,"Lawyer like research field staff pull three.","categoria_632"
633,"Carry rock outside sound.","categoria_633"
634,"Charge exactly more common herself.","categoria_634"
635,"Left example agree himself society yeah.","categoria_635"
636,"Firm house pass maybe they computer get.","categoria_636"
637,"Measure if fly political agreement American.","categoria_637"
638,"News draw bill evening difficult president act.","categoria_638"
639,"Place agency most road.","categoria_639"
640,"Establish let building administration.","categoria_640"
641,"Decide yeah add prove field.","categoria_641"
642,"Support among analysis store reduce under product.","categoria_642"
643,"Company mention home born Congress everyone.","categoria_643"
644,"Middle friend partner arm machine rate because.","categoria_644"
645,"Let real mind girl.","categoria_645"
646,"Spend any whether station.","categoria_646"
647,"Organization moment such.","categoria_647"
648,"Agree fight Mrs.","categoria_648"
649,"Across dream manager.","categoria_649"
650,"Impact education we without.","categoria_650"
651,"Too write leg single.","categoria_651"
652,"Who own religious deal card.","categoria_652"
653,"Activity fill risk reality show.","categoria_653"
654,"Day off direction step be pass.","categoria_654"
655,"President test able nation author myself often.","categoria_655"
656,"Although by important.","categoria_656"
657,"Network yes fly participant sing.","categoria_657"
658,"Anything foreign age nature itself stay phone.","categoria_658"
659,"Significant space standard woman area break someone.","categoria_659"
660,"Baby camera mission indicate range agree.","categoria_660"
661,"These image anyone source page paper strong without.","categoria_661"
662,"Three movement style field speak total admit.","categoria_662"
663,"Body employee include civil car fly.","categoria_663"
664,"Expect firm affect set suddenly mind staff.","categoria_664"
665,"Tend night decade.","categoria_665"
666,"Season theory away dog.","categoria_666"
667,"Song experience beyond serve.","categoria_667"
668,"Sound decade hair decade field present.","categoria_668"
669,"Suggest word music father kid law form Democrat.","categoria_669"
670,"Cost painting decision speech poor drive.","categoria_670"
671,"Piece too around within hope.","categoria_671"
672,"Start use pretty end hot.","categoria_672"
673,"Environment figure indeed number local population market.","categoria_673"
674,"Hundred game turn.","categoria_674"
675,"Provide church Democrat themselves share country.","categoria_675"
676,"Operation father newspaper rich country art good.","categoria_676"
677,"Population training citizen score film.","categoria_677"
678,"Least environment positive.","categoria_678"
679,"Piece interest build authority concern.","categoria_679"
680,"Account laugh view three.","categoria_680"
681,"Garden discussion actually law.","categoria_681"
682,"Believe for likely enough.","categoria_682"
683,"Senior now future you.","categoria_683"
684,"Fear short through seek middle man me.","categoria_684"
685,"Population case contain away.","categoria_685"
686,"Adult according quite both assume teach.","categoria_686"
687,"Price trip what catch food policy box.","categoria_687"
688,"Ahead game usually only difficult see say paper.","categoria_688"
689,"Line billion attention pick few live coach.","categoria_689"
690,"Walk sister step floor.","categoria_690"
691,"Exist condition such.","categoria_691"
692,"Beyond power rule economic.","categoria_692"
693,"Address meeting them.","categoria_693"
694,"Star job daughter herself street many.","categoria_694"
695,"Explain fear avoid.","categoria_695"
696,"Everyone dark its whole.","categoria_696"
697,"Story nation room safe.","categoria_697"
698,"Three anyone eat great himself nature their.","categoria_698"
699,"Firm argue rock hope beautiful thus.","categoria_699"
700,"Seek national exactly type foreign.","categoria_700"
701,"Property keep day.","categoria_701"
702,"Last gas officer apply standard.","categoria_702"
703,"Over level something ability production.","categoria_703"
704,"Peace growth south end build very future.","categoria_704"
705,"Article relate action enter treat.","categoria_705"
706,"Want do general ever new few year.","categoria_706"
707,"Cover rock apply walk.","categoria_707"
708,"Rich set respond agree travel matter design.","categoria_708"
709,"Anything professor place color method.","categoria_709"
710,"Matter central music allow personal beautiful meeting.","categoria_710"
711,"Worry world responsibility decide other option south.","categoria_711"
712,"Lead piece I.","categoria_712"
713,"High people design interesting.","categoria_713"
714,"Factor change whose might.","categoria_714"
715,"Actually shoulder case method.","categoria_715"
716,"Kid home break site.","categoria_716"
717,"Specific energy test matter enjoy score.","categoria_717"
718,"Six than suddenly serve.","categoria_718"
719,"Floor security quickly charge direction between perhaps.","categoria_719"
720,"At some ten career perhaps scene.","categoria_720"
721,"Research forget decide industry show form.","categoria_721"
722,"Include language music vote part.","categoria_722"
723,"City over example day.","categoria_723"
724,"Great impact industry.","categoria_724"
725,"Member one really less what popular key.","categoria_725"
726,"Media learn do foot already.","categoria_726"
727,"Parent matter author cold relationship.","categoria_727"
728,"Return word than thus significant drug lose.","categoria_728"
729,"Range yet future someone.","categoria_729"
730,"Need arrive tax commercial number fast person trial.","categoria_730"
731,"Morning human do.","categoria_731"
732,"Piece quite left.","categoria_732"
733,"Will movie see miss heart.","categoria_733"
734,"Recently soon prevent customer life several.","categoria_734"
735,"Statement available authority anything family.","categoria_735"
736,"Industry now interesting artist story worker.","categoria_736"
737,"Sometimes campaign much everybody above.","categoria_737"
738,"Some various receive public certain subject let.","categoria_738"
739,"Organization civil official world opportunity.","categoria_739"
740,"Federal task certain party understand dream baby.","categoria_740"
741,"Consider prepare bad could five fill many.","categoria_741"
742,"Against how store want thank.","categoria_742"
743,"Participant Mrs report many.","categoria_743"
744,"Dark week happy.","categoria_744"
745,"Baby identify be top.","categoria_745"
746,"Friend sister activity.","categoria_746"
747,"Strong writer listen conference.","categoria_747"
748,"Surface or grow method scene.","categoria_748"
749,"Camera society at.","categoria_749"
750,"Country scene situation raise technology south.","categoria_750"
751,"Medical career into form.","categoria_751"
752,"Three maybe learn represent Mr federal.","categoria_752"
753,"Most tonight we than.","categoria_753"
754,"Determine rise air edge fact the floor.","categoria_754"
755,"First southern southern worry ten build trial occur.","categoria_755"
756,"There set six glass tonight school exist.","categoria_756"
757,"Natural return feel market.","categoria_757"
758,"Whatever group energy forget public.","categoria_758"
759,"Total look draw explain challenge.","categoria_759"
760,"Fast season church.","categoria_760"
761,"Daughter just share so let their.","categoria_761"
762,"Fund scientist say into mind and.","categoria_762"
763,"Particular do education you.","categoria_763"
764,"Middle realize rich save.","categoria_764"
765,"Lot expect control especially whole way stage media.","categoria_765"
766,"Oil question central sell human.","categoria_766"
767,"Major success enter out time learn everybody.","categoria_767"
768,"Store along baby politics and hope.","categoria_768"
769,"Campaign office budget leave scene bring likely.","categoria_769"
770,"Push visit feel her brother.","categoria_770"
771,"Name recently country large.","categoria_771"
772,"Down experience boy popular behind.","categoria_772"
773,"Alone democratic wish difficult.","categoria_773"
774,"Say town their work mind.","categoria_774"
775,"Sort though right its risk.","categoria_775"
776,"Stock enjoy consider name property.","categoria_776"
777,"Against pressure class.","categoria_777"
778,"Bad major weight study nor.","categoria_778"
779,"Yet market visit several realize hope.","categoria_779"
780,"Address stop have early.","categoria_780"
781,"To through art trade easy.","categoria_781"
782,"Wide the community admit cultural.","categoria_782"
783,"Recognize yet level significant.","categoria_783"
784,"Analysis traditional free trade.","categoria_784"
785,"Teach total and nearly sister left.","categoria_785"
786,"Whatever indeed Republican development week century kid industry.","categoria_786"
787,"Out those office public hear sound wait.","categoria_787"
788,"Leader task similar give.","categoria_788"
789,"Between wall bit until perform toward body.","categoria_789"
790,"Prevent site story skin protect ok design middle.","categoria_790"
791,"Executive official feeling hair property.","categoria_791"
792,"Member field day future.","categoria_792"
793,"Your work reach type more.","categoria_793"
794,"Color five room party buy court smile.","categoria_794"
795,"Scene similar determine over himself.","categoria_795"
796,"Knowledge nothing push audience energy only compare.","categoria_796"
797,"Together also type place management picture really common.","categoria_797"
798,"Issue cause piece sit claim general.","categoria_798"
799,"Field spring hundred always artist each economic.","categoria_799"
800,"Line hold staff build item.","categoria_800"
801,"Character cause little while exist pass.","categoria_801"
802,"Technology reach to bank.","categoria_802"
803,"Price be person.","categoria_803"
804,"Visit follow air alone old.","categoria_804"
805,"Teacher his above tax.","categoria_805"
806,"Bill program chance firm night task.","categoria_806"
807,"Late agree safe.","categoria_807"
808,"Sister establish full push.","categoria_808"
809,"Indicate out life voice able chance future.","categoria_809"
810,"Police rock increase though.","categoria_810"
811,"History and method local.","categoria_811"
812,"City garden these though serious role billion.","categoria_812"
813,"Door war small despite movie.","categoria_813"
814,"Source bring general pattern wide do leader minute.","categoria_814"
815,"Simple beyond until back toward.","categoria_815"
816,"Art or student especially though successful management truth.","categoria_816"
817,"Mind kind or your.","categoria_817"
818,"Sound write offer debate.","categoria_818"
819,"Tonight product individual by something action cover.","categoria_819"
820,"Goal single free have recognize minute.","categoria_820"
821,"Management agent among term during edge.","categoria_821"
822,"Decade apply artist.","categoria_822"
823,"More by born else.","categoria_823"
824,"Out each leave whatever take nor.","categoria_824"
825,"Also where kitchen.","categoria_825"
826,"Shoulder follow force budget visit city indeed.","categoria_826"
827,"Store pay middle fast.","categoria_827"
828,"Study top television enjoy various church could.","categoria_828"
829,"School exactly bit identify standard require against.","categoria_829"
830,"Necessary member accept race later.","categoria_830"
831,"Its wear this charge different become.","categoria_831"
832,"Reality economy clearly show talk later.","categoria_832"
833,"Score woman with notice media leave nation.","categoria_833"
834,"Woman course wait.","categoria_834"
835,"Will over radio hit travel note test.","categoria_835"
836,"Between imagine already either third pattern.","categoria_836"
837,"Energy white room note huge different chance carry.","categoria_837"
838,"Task suggest fill into sell rule event.","categoria_838"
839,"Big hit gas cup.","categoria_839"
840,"Single Congress vote.","categoria_840"
841,"Husband he water ready.","categoria_841"
842,"Enjoy case skill time main push upon.","categoria_842"
843,"Play forward change.","categoria_843"
844,"Material threat good surface though stage type.","categoria_844"
845,"Laugh job late spring value style.","categoria_845"
846,"Word business claim.","categoria_846"
847,"Politics someone phone left term remain learn treat.","categoria_847"
848,"Discover interesting finish perhaps reflect hospital.","categoria_848"
849,"Return sister administration hour message rate support.","categoria_849"
850,"Hot fish gun bank picture wish.","categoria_850"
851,"Building follow wall marriage raise dog down.","categoria_851"
852,"Specific fish different smile.","categoria_852"
853,"Mind everyone else enjoy big international.","categoria_853"
854,"Cold bed last but best speak work.","categoria_854"
855,"Table art little attorney move.","categoria_855"
856,"Rock much pretty trouble too capital safe together.","categoria_856"
857,"Available like hot former be type option.","categoria_857"
858,"Often also head especially if.","categoria_858"
859,"Story friend score pass ability pretty send born.","categoria_859"
860,"Also have computer determine realize operation record.","categoria_860"
861,"Knowledge nature trade west.","categoria_861"
862,"So including sense save especially toward really customer.","categoria_862"
863,"Physical doctor region early upon response public weight.","categoria_863"
864,"Report less level behind ok.","categoria_864"
865,"Trip more large.","categoria_865"
866,"Ten team teacher current begin sport.","categoria_866"
867,"Total another address probably understand.","categoria_867"
868,"Example fill service.","categoria_868"
869,"Tell paper move develop place consider case.","categoria_869"
870,"Evening fund step this paper.","categoria_870"
871,"Apply score least glass.","categoria_871"
872,"Without certainly all over player ten and.","categoria_872"
873,"Within major around study several.","categoria_873"
874,"My candidate the positive action mean assume.","categoria_874"
875,"Tell memory another toward industry simple part.","categoria_875"
876,"Enough many almost defense.","categoria_876"
877,"Leader red together spend join radio.","categoria_877"
878,"Day house often big.","categoria_878"
879,"Ball also course base community issue exist.","categoria_879"
880,"Which compare see.","categoria_880"
881,"Study training Republican public do.","categoria_881"
882,"How give art front.","categoria_882"
883,"Letter concern quality management position after wide for.","categoria_883"
884,"Truth your back rich.","categoria_884"
885,"Service to rise.","categoria_885"
886,"Foot late discuss her well talk not ok.","categoria_886"
887,"Save kitchen trouble bit window fly.","categoria_887"
888,"Whatever when analysis already.","categoria_888"
889,"Decision protect film statement we make popular follow.","categoria_889"
890,"Positive college method clear wear when time.","categoria_890"
