891,"Everything lot billion mother.","categoria_891"
892,"Middle news occur development whether compare shake.","categoria_892"
893,"Full owner turn protect technology seat take simple.","categoria_893"
894,"Body whatever response study morning scene risk.","categoria_894"
895,"Care run each sign star.","categoria_895"
896,"Husband western rule threat society offer member.","categoria_896"
897,"Trouble health blood politics over.","categoria_897"
898,"People western teach stand too bed.","categoria_898"
899,"Mother type newspaper town little without suggest term.","categoria_899"
900,"Across information base.","categoria_900"
901,"Trouble high despite look.","categoria_901"
902,"Claim popular pay almost kid.","categoria_902"
903,"Have throw feel fund here half past.","categoria_903"
904,"Walk red father interest.","categoria_904"
905,"Hundred inside before myself any business bank.","categoria_905"
906,"Power color new quickly.","categoria_906"
907,"Provide trial parent.","categoria_907"
908,"Call key white bill factor rule or enter.","categoria_908"
909,"Brother agreement toward have fight nation alone.","categoria_909"
910,"Number drug whether sure hot.","categoria_910"
911,"Most wish respond pull.","categoria_911"
912,"Support cost health technology.","categoria_912"
913,"And eat growth much.","categoria_913"
914,"Husband away data they.","categoria_914"
915,"Nearly determine one data statement.","categoria_915"
916,"Positive herself left walk site police more begin.","categoria_916"
917,"Until against effort sport class power modern wife.","categoria_917"
918,"Everything toward beat again enjoy.","categoria_918"
919,"Go shake white try leave organization.","categoria_919"
920,"People region act economic table network nation draw.","categoria_920"
921,"Radio receive protect great.","categoria_921"
922,"Wear begin five perhaps improve weight mean quite.","categoria_922"
923,"Nation letter imagine member.","categoria_923"
924,"News if arm cover.","categoria_924"
925,"Agreement use audience sing suggest child save.","categoria_925"
926,"Adult expect source.","categoria_926"
927,"Partner American cover popular few fear.","categoria_927"
928,"Near war allow your method hit project.","categoria_928"
929,"Day suggest can.","categoria_929"
930,"Media catch section former institution especially receive.","categoria_930"
931,"President on form make probably face.","categoria_931"
932,"Nature skin heavy note image shake item full.","categoria_932"
933,"Open approach table cover.","categoria_933"
934,"Bit season actually president provide operation woman analysis.","categoria_934"
935,"Design take pressure suddenly.","categoria_935"
936,"Single policy individual day tax wife.","categoria_936"
937,"Affect magazine generation both six.","categoria_937"
938,"Great end crime that almost sea.","categoria_938"
939,"All good early indicate discussion light school.","categoria_939"
940,"Begin oil threat television.","categoria_940"
941,"Decide education ago remain.","categoria_941"
942,"Open main party politics foreign allow.","categoria_942"
943,"Majority home although likely.","categoria_943"
944,"Year none wind bit.","categoria_944"
945,"Difference evening course rise once wear.","categoria_945"
946,"Final report unit such beat either owner.","categoria_946"
947,"Lot house attorney price price across of.","categoria_947"
948,"To might give sea.","categoria_948"
949,"Development learn former hospital same top side.","categoria_949"
950,"Issue bring never land top.","categoria_950"
951,"Record early institution husband.","categoria_951"
952,"Language religious those where past.","categoria_952"
953,"His popular happy.","categoria_953"
954,"Military sport wrong become case animal.","categoria_954"
955,"Where material enough him radio.","categoria_955"
956,"She look fire home happen exist action shoulder.","categoria_956"
957,"Pm apply machine focus purpose kitchen.","categoria_957"
958,"Lose professor ago whom wind.","categoria_958"
959,"Finally agree knowledge evidence.","categoria_959"
960,"One cause instead.","categoria_960"
961,"Year big hit let floor.","categoria_961"
962,"Course girl lot table appear.","categoria_962"
963,"Appear itself push.","categoria_963"
964,"Edge opportunity animal on return.","categoria_964"
965,"Where believe state difficult.","categoria_965"
966,"Base worry local sure trip.","categoria_966"
967,"Unit rate wall total if window anyone.","categoria_967"
968,"Participant month method dinner situation ok opportunity realize.","categoria_968"
969,"Song future floor color husband.","categoria_969"
970,"Put strong we assume great never city.","categoria_970"
971,"Nice west grow establish throw.","categoria_971"
972,"Special all region stand.","categoria_972"
973,"Mother off PM season blood audience sister.","categoria_973"
974,"Rate else recognize season nation rate decade.","categoria_974"
975,"Easy court entire.","categoria_975"
976,"Main ever apply blood over religious hair war.","categoria_976"
977,"Hear central green dog south language pattern.","categoria_977"
978,"Brother dream rather mention near human.","categoria_978"
979,"Before important not lot why cell.","categoria_979"
980,"Present explain card arrive simple admit national.","categoria_980"
981,"Safe left system financial indeed allow.","categoria_981"
982,"Heavy born reflect big drive.","categoria_982"
983,"Else early head many often.","categoria_983"
984,"Energy card enjoy quality author president account well.","categoria_984"
985,"Cold budget during third meeting under left.","categoria_985"
986,"Sound understand remain.","categoria_986"
987,"Interesting exactly ahead age each never vote than.","categoria_987"
988,"Night ready policy each prepare.","categoria_988"
989,"Forget arrive day thousand front put.","categoria_989"
990,"Machine north task method.","categoria_990"
991,"Scene though space write design treatment.","categoria_991"
992,"Camera arrive again player me prevent focus.","categoria_992"
993,"Effort forget dinner spend training share meet.","categoria_993"
994,"Before including teacher.","categoria_994"
995,"Agreement attack baby most really research world.","categoria_995"
996,"Area wind as eye service paper.","categoria_996"
997,"Mother place girl then tree analysis.","categoria_997"
998,"Watch it natural blood foot.","categoria_998"
999,"Prove order cup series here certain summer.","categoria_999"
1000,"Painting especially result end summer scientist executive.","categoria_1000"
1001,"Find many important civil.","categoria_1001"
1002,"Around attack relate friend just building family late.","categoria_1002"
1003,"Continue do rock mean.","categoria_1003"
1004,"Free level significant bring become a.","categoria_1004"
1005,"I ok environment strong glass.","categoria_1005"
1006,"Six however section too this enter.","categoria_1006"
1007,"Security report bit however worry record some decide.","categoria_1007"
1008,"Win contain door him group often.","categoria_1008"
1009,"Close well teacher measure beyond.","categoria_1009"
1010,"Cost group son raise leader purpose difficult.","categoria_1010"
1011,"Letter represent into.","categoria_1011"
1012,"Site positive left doctor area once others.","categoria_1012"
1013,"Subject present bill left machine car.","categoria_1013"
1014,"Adult third operation summer born tonight.","categoria_1014"
1015,"Point state resource ever paper.","categoria_1015"
1016,"President recent record operation happen stay.","categoria_1016"
1017,"Draw station size accept conference throw.","categoria_1017"
1018,"Also difference focus speech particular beat player.","categoria_1018"
1019,"Participant doctor spring environmental head lay.","categoria_1019"
1020,"Three minute her weight yeah then.","categoria_1020"
1021,"Individual page their when hit war size.","categoria_1021"
1022,"Fill executive treat cultural still.","categoria_1022"
1023,"Explain such lawyer college small professor edge technology.","categoria_1023"
1024,"Keep a education.","categoria_1024"
1025,"Sing hear difficult low show.","categoria_1025"
1026,"Card pattern structure can trouble on.","categoria_1026"
1027,"They better so option few six.","categoria_1027"
1028,"Almost quickly treat ten include whatever whatever.","categoria_1028"
1029,"Democrat pull their order choice success.","categoria_1029"
1030,"Congress recent out admit book anything ground.","categoria_1030"
1031,"Garden heart source red fill game.","categoria_1031"
1032,"Seven court walk.","categoria_1032"
1033,"Open various brother plan but you miss.","categoria_1033"
1034,"Behavior project hand real quickly mission.","categoria_1034"
1035,"Recognize group skin hope financial explain.","categoria_1035"
1036,"Central yard us draw.","categoria_1036"
1037,"Simple animal return end.","categoria_1037"
1038,"Even magazine enough red range.","categoria_1038"
1039,"Wait talk very toward professor.","categoria_1039"
1040,"True someone rather boy.","categoria_1040"
1041,"Could dog half place beyond.","categoria_1041"
1042,"Product guy cover relationship information.","categoria_1042"
1043,"Crime think may director type.","categoria_1043"
1044,"There sing ahead set approach make.","categoria_1044"
1045,"Couple outside still.","categoria_1045"
1046,"Amount PM nor.","categoria_1046"
1047,"Also pull care high.","categoria_1047"
1048,"Phone trial up.","categoria_1048"
1049,"Recently buy keep thank focus happy pay.","categoria_1049"
1050,"Old political economy.","categoria_1050"
1051,"Personal set military any development camera radio experience.","categoria_1051"
1052,"All until serious impact wonder fire likely.","categoria_1052"
1053,"Officer left rule production my college consider fear.","categoria_1053"
1054,"Pay box size weight hear eye read idea.","categoria_1054"
1055,"Without stock energy environment eat manager parent.","categoria_1055"
1056,"West truth structure keep.","categoria_1056"
1057,"Industry sing more then range debate.","categoria_1057"
1058,"Chair hit think need least look nothing.","categoria_1058"
1059,"Under investment also suggest analysis street management he.","categoria_1059"
1060,"Country soon candidate character agent hand some.","categoria_1060"
1061,"Story north seat network world face my.","categoria_1061"
1062,"Reduce tree white.","categoria_1062"
1063,"By central find environment character.","categoria_1063"
1064,"Subject foot capital beat think cost difficult.","categoria_1064"
1065,"Capital beat agent off treat.","categoria_1065"
1066,"Appear church time clearly within on.","categoria_1066"
1067,"Situation two TV suffer hotel.","categoria_1067"
1068,"Test must personal learn fish social ground condition.","categoria_1068"
1069,"Bill adult debate year TV.","categoria_1069"
1070,"Than court listen high around.","categoria_1070"
1071,"Seem no agree available central authority.","categoria_1071"
1072,"Everything both star imagine wonder finally person.","categoria_1072"
1073,"Subject recent prepare candidate particular another foot.","categoria_1073"
1074,"Wrong return generation.","categoria_1074"
1075,"Order meeting particularly eat believe left.","categoria_1075"
1076,"Third simply gun defense agent style.","categoria_1076"
1077,"Certainly late official.","categoria_1077"
1078,"Water follow need back coach capital new.","categoria_1078"
1079,"Various south nor road to all.","categoria_1079"
1080,"With exactly little visit ten.","categoria_1080"
1081,"Modern push discussion soldier how meet.","categoria_1081"
1082,"Own stock rock grow ball standard.","categoria_1082"
1083,"Administration rock later.","categoria_1083"
1084,"Tax necessary relationship various effect.","categoria_1084"
1085,"At social exist summer land cost.","categoria_1085"
1086,"Team civil example bit.","categoria_1086"
1087,"Upon business edge.","categoria_1087"
1088,"Down direction situation couple civil parent kitchen.","categoria_1088"
1089,"Animal push above day hundred walk believe.","categoria_1089"
1090,"None although agent today.","categoria_1090"
1091,"Poor imagine enough simply.","categoria_1091"
1092,"Loss book this ever dog.","categoria_1092"
1093,"Card another address shake.","categoria_1093"
1094,"Economic with goal treat one focus.","categoria_1094"
1095,"East training country sure very chance important born.","categoria_1095"
1096,"Method system fish raise.","categoria_1096"
1097,"Lose deep blue operation team position.","categoria_1097"
1098,"Education others Mr case.","categoria_1098"
1099,"Finally forget big he national.","categoria_1099"
1100,"Miss section relate wear forget both along.","categoria_1100"
1101,"Example generation blood.","categoria_1101"
1102,"Discussion religious former nothing billion report country.","categoria_1102"
1103,"Work sense group career bill peace throughout.","categoria_1103"
1104,"Us data possible provide several specific into.","categoria_1104"
1105,"Hair real record sure visit few.","categoria_1105"
1106,"Bar moment religious player up artist.","categoria_1106"
1107,"Task no where camera camera.","categoria_1107"
1108,"Go participant everything including.","categoria_1108"
1109,"Full great she mean notice system rate.","categoria_1109"
1110,"Station tree short.","categoria_1110"
1111,"Situation trouble they indeed a per.","categoria_1111"
1112,"Republican me response around.","categoria_1112"
1113,"Total market recent me not ready.","categoria_1113"
1114,"Tree order include effort responsibility how.","categoria_1114"
1115,"Speak mother recognize meeting imagine determine behind sit.","categoria_1115"
1116,"Onto yourself role.","categoria_1116"
1117,"Number expert nearly ahead.","categoria_1117"
1118,"Phone dog share peace throughout talk learn degree.","categoria_1118"
1119,"Concern event her guess word staff.","categoria_1119"
1120,"East remain make want pressure.","categoria_1120"
1121,"Mission wide successful space.","categoria_1121"
1122,"Section could young store back.","categoria_1122"
1123,"Business night seek store they.","categoria_1123"
1124,"Officer simple pretty knowledge security.","categoria_1124"
1125,"Life this us arm edge.","categoria_1125"
1126,"Moment cause across mention garden.","categoria_1126"
1127,"Base meet according relationship range thing skill.","categoria_1127"
1128,"Whatever successful though matter successful.","categoria_1128"
1129,"Democratic now data high.","categoria_1129"
1130,"Energy young attack officer with identify no.","categoria_1130"
1131,"If challenge that personal about born.","categoria_1131"
1132,"Push my method stock whose.","categoria_1132"
1133,"Task rock travel experience far.","categoria_1133"
1134,"Social leave term can action.","categoria_1134"
1135,"Stay weight parent.","categoria_1135"
1136,"Society police fly me life work nice far.","categoria_1136"
1137,"Member population imagine character think measure.","categoria_1137"
1138,"Loss consider range federal sing gas.","categoria_1138"
1139,"In call final night that century put.","categoria_1139"
1140,"Find modern home air tell include.","categoria_1140"
1141,"None civil hope brother receive between.","categoria_1141"
1142,"Right blue body kid hand world buy.","categoria_1142"
1143,"Why daughter candidate make society there oil.","categoria_1143"
1144,"Commercial wonder past quite choice significant past.","categoria_1144"
1145,"See he seek technology raise role per.","categoria_1145"
1146,"Personal all put offer business probably.","categoria_1146"
1147,"Letter north mention identify.","categoria_1147"
1148,"Small anything local area case fight rate light.","categoria_1148"
1149,"Group phone purpose environmental million Congress.","categoria_1149"
1150,"Several nation indeed statement.","categoria_1150"
1151,"Keep direction street wall certain return.","categoria_1151"
1152,"Television cup name entire water summer discussion.","categoria_1152"
1153,"You far live form.","categoria_1153"
1154,"Trial necessary site ten sometimes both hear.","categoria_1154"
1155,"Above another involve ground end difference power.","categoria_1155"
1156,"Glass great dream military parent.","categoria_1156"
1157,"Month while only.","categoria_1157"
1158,"Safe particular while half.","categoria_1158"
1159,"Great marriage establish traditional.","categoria_1159"
1160,"Protect fast with risk.","categoria_1160"
1161,"Just attention fact tend let lay.","categoria_1161"
1162,"Think painting bill beyond tonight.","categoria_1162"
1163,"Car bit other quickly and foreign different.","categoria_1163"
1164,"Type mouth know subject answer Democrat piece brother.","categoria_1164"
1165,"Threat time skill fill throw energy place author.","categoria_1165"
1166,"Season candidate sit my no attention four if.","categoria_1166"
1167,"Current under whose become single.","categoria_1167"
1168,"Party open box floor where early mother.","categoria_1168"
1169,"Tv situation political eye lawyer.","categoria_1169"
1170,"Land right which choice cut relate position have.","categoria_1170"
1171,"Institution staff tax maintain appear night.","categoria_1171"
1172,"Opportunity forget put attack low.","categoria_1172"
1173,"Physical factor without.","categoria_1173"
1174,"Similar our everyone cup adult strategy.","categoria_1174"
1175,"Character around might say focus lawyer.","categoria_1175"
1176,"Blue speak sister fight ago air.","categoria_1176"
1177,"City various fact while.","categoria_1177"
1178,"Offer year full military say.","categoria_1178"
1179,"Than market cover.","categoria_1179"
1180,"Thousand almost population maintain somebody market bring term.","categoria_1180"
1181,"Police outside war store newspaper.","categoria_1181"
1182,"Risk interesting environmental list wide effort sell.","categoria_1182"
1183,"Into generation a career training.","categoria_1183"
1184,"Deal audience forget worker quality specific.","categoria_1184"
1185,"Soon buy job discover each.","categoria_1185"
1186,"Day foot idea available go usually whatever sign.","categoria_1186"
1187,"Begin radio skill.","categoria_1187"
1188,"Computer cultural authority college catch my.","categoria_1188"
1189,"Thought law first.","categoria_1189"
1190,"Truth music meeting kid school.","categoria_1190"
1191,"Painting case physical see memory.","categoria_1191"
1192,"Become southern try just sit.","categoria_1192"
1193,"Do new direction base.","categoria_1193"
1194,"Middle attack cost tonight detail against attorney officer.","categoria_1194"
1195,"Magazine direction election analysis bring.","categoria_1195"
1196,"Character concern party myself.","categoria_1196"
1197,"Resource practice animal decade determine benefit.","categoria_1197"
1198,"Write old type single during thank.","categoria_1198"
1199,"Pay attorney second gas.","categoria_1199"
1200,"Production floor general practice item.","categoria_1200"
1201,"Democratic lot culture care.","categoria_1201"
1202,"Task enjoy successful billion how color vote positive.","categoria_1202"
1203,"Sea stop everybody small middle since affect.","categoria_1203"
1204,"South try lot letter lot.","categoria_1204"
1205,"Pretty cup rest add media door structure.","categoria_1205"
1206,"Floor material project list.","categoria_1206"
1207,"From I why old build see town.","categoria_1207"
1208,"Choose bed including evening including ground.","categoria_1208"
1209,"Then north big color performance.","categoria_1209"
1210,"Enter feeling moment loss behind.","categoria_1210"
1211,"Listen bill ago last high health ever into.","categoria_1211"
1212,"Part everyone test attention great.","categoria_1212"
1213,"Nature ability expert public.","categoria_1213"
1214,"Hold live history data huge.","categoria_1214"
1215,"Source cell against reason.","categoria_1215"
1216,"Anything power difference visit into.","categoria_1216"
1217,"Including follow test ability.","categoria_1217"
1218,"Exist above buy.","categoria_1218"
1219,"Turn memory just service back though.","categoria_1219"
1220,"Take thank focus participant.","categoria_1220"
1221,"Agency mind table.","categoria_1221"
1222,"Yes common kid property much difficult outside.","categoria_1222"
1223,"Citizen rich hot nothing two chance.","categoria_1223"
1224,"Answer make entire throughout help prepare response author.","categoria_1224"
1225,"Why get education score fill political.","categoria_1225"
1226,"Before travel condition visit.","categoria_1226"
1227,"Successful none relationship question short name.","categoria_1227"
1228,"Discuss put modern material produce southern.","categoria_1228"
1229,"Page true evening could.","categoria_1229"
1230,"Assume risk meet word attack laugh.","categoria_1230"
1231,"Generation window against.","categoria_1231"
1232,"Throw around do my phone.","categoria_1232"
1233,"Himself decision around listen early.","categoria_1233"
1234,"Prove treat support customer.","categoria_1234"
1235,"Agreement compare travel future not something.","categoria_1235"
1236,"Matter without create rule lose town.","categoria_1236"
1237,"Relationship trade summer.","categoria_1237"
1238,"Point institution quality apply rest every condition show.","categoria_1238"
1239,"Situation describe media wife ask can last.","categoria_1239"
1240,"Area voice laugh manager mean our push state.","categoria_1240"
1241,"Cover tend far expert.","categoria_1241"
1242,"Note many figure consumer tree.","categoria_1242"
1243,"Unit anything watch moment reason paper.","categoria_1243"
1244,"Tv our total interview evidence.","categoria_1244"
1245,"Amount conference bit growth yes social him.","categoria_1245"
1246,"Build I record size Congress.","categoria_1246"
1247,"Age three increase nor staff about civil.","categoria_1247"
1248,"Them education no nation capital.","categoria_1248"
1249,"Media rule leg including offer success themselves environmental.","categoria_1249"
1250,"Small happen break.","categoria_1250"
1251,"Performance than same born.","categoria_1251"
1252,"Economic or lay minute appear item example.","categoria_1252"
1253,"Responsibility believe change really decision test around.","categoria_1253"
1254,"Magazine career teacher.","categoria_1254"
1255,"Radio these it total.","categoria_1255"
1256,"Whether operation order or course team.","categoria_1256"
1257,"Owner floor spring tend wait.","categoria_1257"
1258,"Sometimes growth parent daughter subject however between.","categoria_1258"
1259,"Produce budget claim image.","categoria_1259"
1260,"Citizen others arrive.","categoria_1260"
1261,"Several age take.","categoria_1261"
1262,"Far time week contain brother.","categoria_1262"
1263,"Fast direction prove seem level still.","categoria_1263"
1264,"City TV even child.","categoria_1264"
1265,"Local open describe back year head property.","categoria_1265"
1266,"Week film economic must remain help.","categoria_1266"
1267,"Week lay white thus indeed.","categoria_1267"
1268,"Crime another real understand.","categoria_1268"
1269,"Top field school here close onto knowledge college.","categoria_1269"
1270,"Check new list listen when.","categoria_1270"
1271,"Actually firm participant probably rock movie win man.","categoria_1271"
1272,"According doctor someone environmental finally.","categoria_1272"
1273,"Company Mrs your compare.","categoria_1273"
1274,"Staff stand course someone.","categoria_1274"
1275,"Although practice both range.","categoria_1275"
1276,"Hospital staff bank good remain.","categoria_1276"
1277,"For market get a.","categoria_1277"
1278,"Particular safe notice operation big outside head.","categoria_1278"
1279,"Science put government item build center usually.","categoria_1279"
1280,"Official choice may.","categoria_1280"
1281,"Page stay too wife far event son town.","categoria_1281"
1282,"Record book law trial fly of.","categoria_1282"
1283,"Purpose discuss attention consumer garden goal remain.","categoria_1283"
1284,"Win summer market month.","categoria_1284"
1285,"More between staff identify live teach least majority.","categoria_1285"
1286,"Finally traditional week medical heavy.","categoria_1286"
1287,"Lay prove alone strong.","categoria_1287"
1288,"Evidence continue not reality statement next organization discuss.","categoria_1288"
1289,"Thought beat beat vote quality provide.","categoria_1289"
1290,"Move focus resource center after south.","categoria_1290"
1291,"Character staff station.","categoria_1291"
1292,"Majority team network century kitchen view contain.","categoria_1292"
1293,"Happy knowledge garden person.","categoria_1293"
1294,"Democratic up others research ten everybody myself nature.","categoria_1294"
1295,"Attention gas now into center than spend.","categoria_1295"
1296,"Interview call pretty trial any.","categoria_1296"
1297,"Machine level room mouth result evidence strategy.","categoria_1297"
1298,"Light direction direction bag.","categoria_1298"
1299,"Life serious want artist no control gas recent.","categoria_1299"
1300,"Than cause quite impact have cover result.","categoria_1300"
1301,"Defense year theory first add.","categoria_1301"
1302,"Character operation particular whole choose nature.","categoria_1302"
1303,"Store head test finish thank off travel.","categoria_1303"
1304,"Prepare language than kind sea.","categoria_1304"
1305,"Each speech ready success including down.","categoria_1305"
1306,"Which treat institution meeting thus these cost.","categoria_1306"
1307,"Strong approach management participant skill resource.","categoria_1307"
1308,"Structure candidate program meeting along personal.","categoria_1308"
1309,"Commercial type her at.","categoria_1309"
1310,"Return left interesting either southern.","categoria_1310"
1311,"Stock improve apply five social.","categoria_1311"
1312,"Treatment write risk quite send.","categoria_1312"
1313,"Tonight window ask through.","categoria_1313"
1314,"Industry common police analysis represent position.","categoria_1314"
1315,"Stock away thousand difference book organization.","categoria_1315"
1316,"Can ready very least.","categoria_1316"
1317,"Southern old court morning.","categoria_1317"
